Nr.|Text|ADD|AUF|FKT|REL|ZIE|THE|KON
X|||||||FAST|ABW
0|An der Leonardo da-Vinci Gesamtschule wird seit einigen Tagen disskutiert, ob Fast Food oder selber kochen besser ist.|N|EIN|AHG||||
1|"Durch die Zeitung ""Der kleine Gourmet"" haben wir von den Sch³lervertretern einen Zeitungsartikel geschrieben."|N|EIN|AHG||||
2|Man sollte Fast Food kaufen statt selbst zu kochen.|N|HAU|TH2||||
3|Das Fast Food essen ist oftmals g³nstiger als selber zu kochen.|N|HAU|CON||||
4|Noemie (19 Jahre alt) verdient als Studentin kein Geld|N|HAU|CON||||
5|und deswegen hat sie kein Geld frisch und gesund zu kochen.|N|HAU|CON||||
6|Sie geht lieber zu einem Fast Food Geschõft.|N|HAU|CON||||
7|Das stõrkste Agument Fast Food zu kaufen und zu essen ist, dass es schnell zubereitet ist.|N|HAU|CON||||
8|Linda (23 Jahre alt) kommt von einem langem Tag nachhause und m÷chte nicht stundenlang in der K³che stehen.|N|HAU|CON||||
9|Deswegen geht sie zu einem Fast Food Geschõft im Bahnhof.|N|HAU|CON||||
10|Nach drei Minuten (ohne anstehen) hat sie ihr essen und schafft sogar ihre Bahn.|N|HAU|CON||||
11|Man sollte kein Fast Food kaufen und lieber selbst kochen.|N|HAU|TH1||||
12|Das stõrkste Agument selbst zu kochen ist, dass es ges³nder ist.|N|HAU|PRO||||
13|Marie und ihre kleine Tochter Clara (32 Jahre alt und 4 Jahre alt) wohnen alleine und f³r die beiden ist es wichtig, dass das essen gesund ist.|N|HAU|PRO||||
14|Die beiden haben fr³hrer immer an Fast Food Geschõften angestanden, bis Maries Tochter Clara Bauchschmerzen bekommen hat.|N|HAU|PRO||||
15|Seitdem haben die beide mehr spa▀ selber zu kochen als an einem Fast Food geschõft anzustehen.|N|HAU|PRO||||
16|Auch f³r uns der Sch³lervertreter ist es wichtig, dass das Essen gesund ist.|N|SCH|ZTH||||
17|Auch bei unserem Essenanbieter ist das essen gesund und frisch.|N|SCH|PRO||||
18|Deswegen kochen Sie lieber frisch und gesund anstatt in ein Fast Food geschõft zu gehen.|N|SCH|PRO||||
19|Probieren Sie eine Ofenkartofell mit einem frischen Salat.|N|SCH|SON||||
